movieId,title,year,genres,director,cast,overview,poster
1,Toy Story (1995),1995,Adventure|Animation|Children|Comedy|Fantasy,John Lasseter,Tom Hanks Tim Allen Don Rickles Jim Varney Wallace Shawn,"Led by Woody, Andy's toys live happily in his room until Andy's birthday brings Buzz Lightyear onto the scene. Afraid of losing his place in Andy's heart, Woody plots against Buzz. But when circumstances separate Buzz and Woody from their owner, the duo eventually learns to put aside their differences.",https://image.tmdb.org/t/p/w500/uXDfjJbdP4ijW5hWSBrPrlKpxab.jpg
2,Jumanji (1995),1995,Adventure|Children|Fantasy,Joe Johnston,Robin Williams Kirsten Dunst Bradley Pierce Bonnie Hunt Jonathan Hyde,"When siblings Judy and Peter discover an enchanted board game that opens the door to a magical world, they unwittingly invite Alan -- an adult who's been trapped inside the game for 26 years -- into their living room. Alan's only hope for freedom is to finish the game, which proves risky as all three find themselves running from giant rhinoceroses, evil monkeys and other terrifying creatures.",https://image.tmdb.org/t/p/w500/iWV47r6kFneCiApgrMII5HSkfHw.jpg
3,Grumpier Old Men (1995),1995,Comedy|Romance,Howard Deutch,Walter Matthau Jack Lemmon Ann-Margret Sophia Loren Daryl Hannah,"A family wedding reignites the ancient feud between next-door neighbors and fishing buddies John and Max. Meanwhile, a sultry Italian divorcée opens a restaurant at the local bait shop, alarming the locals who worry she'll scare the fish away. But she's less interested in seafood than she is in cooking up a hot time with Max.",https://image.tmdb.org/t/p/w500/1FSXpj5e8l4KH6nVFO5SPUeraOt.jpg
4,Waiting to Exhale (1995),1995,Comedy|Drama|Romance,Forest Whitaker,Whitney Houston Angela Bassett Loretta Devine Lela Rochon Gregory Hines,"Cheated on, mistreated and stepped on, the women are holding their breath, waiting for the elusive ""good man"" to break a string of less-than-stellar lovers. Friends and confidants Vannah, Bernie, Glo and Robin talk it all out, determined to find a better way to breathe.",https://image.tmdb.org/t/p/w500/4wjGMwPsdlvi025ZqR4rXnFDvBz.jpg
5,Father of the Bride Part II (1995),1995,Comedy,Charles Shyer,Steve Martin Diane Keaton Martin Short Kimberly Williams-Paisley George Newbern,"Just when George Banks has recovered from his daughter's wedding, he receives the news that she's pregnant ... and that George's wife is expecting too. He was planning on selling their home, but that's a plan that—like George—will have to change with the arrival of both a grandchild and a kid of his own.",https://image.tmdb.org/t/p/w500/rj4LBtwQ0uGrpBnCELr716Qo3mw.jpg
6,Heat (1995),1995,Action|Crime|Thriller,Michael Mann,Al Pacino Robert De Niro Val Kilmer Jon Voight Tom Sizemore,Obsessive master thief Neil McCauley leads a top-notch crew on various daring heists throughout Los Angeles while determined detective Vincent Hanna pursues him without rest. Each man recognizes and respects the ability and the dedication of the other even though they are aware their cat-and-mouse game may end in violence.,https://image.tmdb.org/t/p/w500/e09dLw1Ljtccd2P4NsuUvVtS5du.jpg
7,Sabrina (1995),1995,Comedy|Romance,Sydney Pollack,Harrison Ford Julia Ormond Greg Kinnear Nancy Marchand John Wood,"After her return from school in Paris, a playboy finally takes notice of his family's chauffeur's daughter Sabrina, who's long had a crush on him, but he questions his more serious brother's motives when he warns against getting involved with her.",https://image.tmdb.org/t/p/w500/i8PbLJDPU7vCwwscWD625oHbJy.jpg
8,Tom and Huck (1995),1995,Adventure|Children,Peter Hewitt,Jonathan Taylor Thomas Brad Renfro Eric Schweig Charles Rocket Amy Wright,"A mischievous young boy, Tom Sawyer, witnesses a murder by the deadly Injun Joe. Tom becomes friends with Huckleberry Finn, a boy with no future and no family. Tom has to choose between honoring a friendship or honoring an oath because the town alcoholic is accused of the murder. Tom and Huck go through several adventures trying to retrieve evidence.",https://image.tmdb.org/t/p/w500/bMY31ikEOIPOHqQwhPhII8UVBln.jpg
9,Sudden Death (1995),1995,Action,Peter Hyams,Jean-Claude Van Damme Powers Boothe Raymond J. Barry Whittni Wright Ross Malinger,When a man's daughter is suddenly taken during a championship hockey game – with the captors demanding a billion dollars by game's end – he frantically sets a plan in motion to rescue her and abort an impending explosion before the final buzzer.,https://image.tmdb.org/t/p/w500/1pylO6YX5XdOA6QCc5IRxrrffkg.jpg
10,GoldenEye (1995),1995,Action|Adventure|Thriller,Martin Campbell,Pierce Brosnan Sean Bean Izabella Scorupco Famke Janssen Joe Don Baker,"When a powerful secret defense system is stolen, James Bond is assigned to stop a Russian crime syndicate from using it.",https://image.tmdb.org/t/p/w500/z0ljRnNxIO7CRBhLEO0DvLgAFPR.jpg
11,"American President, The (1995)",1995,Comedy|Drama|Romance,Rob Reiner,Michael Douglas Annette Bening Martin Sheen Michael J. Fox Anna Deavere Smith,"Widowed U.S. president Andrew Shepherd, one of the world's most powerful men, can have anything he wants -- and what he covets most is Sydney Ellen Wade, a Washington lobbyist. But Shepherd's attempts at courting her spark wild rumors and decimate his approval ratings.",https://image.tmdb.org/t/p/w500/yObOAYFIHXHkFPQ3jhgkN2ezaD.jpg
12,Dracula: Dead and Loving It (1995),1995,Comedy|Horror,Mel Brooks,Leslie Nielsen Mel Brooks Amy Yasbeck Peter MacNicol Lysette Anthony,"When a lawyer shows up at the vampire's doorstep, he falls prey to his charms and joins him in his search for fresh blood. Enter Professor Van Helsing, who may be the only one able to vanquish the Count.",https://image.tmdb.org/t/p/w500/4rRfZz8YnHNRr16t3CFcJrPdXHi.jpg
13,Balto (1995),1995,Adventure|Animation|Children,Simon Wells,Kevin Bacon Bob Hoskins Bridget Fonda Jim Cummings Phil Collins,"An outcast half-wolf risks his life to prevent a deadly epidemic from ravaging Nome, Alaska.",https://image.tmdb.org/t/p/w500/dCVcdb5oxDizqFLz0F7TE60NoC9.jpg
14,Nixon (1995),1995,Drama,Oliver Stone,Anthony Hopkins Joan Allen Powers Boothe Ed Harris Bob Hoskins,A look at President Richard M. Nixon—a man carrying the fate of the world on his shoulders while battling the self-destructive demands from within—spanning his troubled boyhood in California to the shocking Watergate scandal that would end his Presidency.,https://image.tmdb.org/t/p/w500/cz2MTGr2wpDZLirgV2rGHBdA2t3.jpg
15,Cutthroat Island (1995),1995,Action|Adventure|Romance,Renny Harlin,Geena Davis Matthew Modine Frank Langella Maury Chaykin Patrick Malahide,"Morgan Adams and her slave, William Shaw, are on a quest to recover the three portions of a treasure map. Unfortunately, the final portion is held by her murderous uncle, Dawg. Her crew is skeptical of her leadership abilities, so she must complete her quest before they mutiny against her. This is made yet more difficult by the efforts of the British crown to end her pirate raids.",https://image.tmdb.org/t/p/w500/hYdeBZ4BFXivdouxLfQGWNE6zRx.jpg
16,Casino (1995),1995,Crime|Drama,Martin Scorsese,Robert De Niro Sharon Stone Joe Pesci James Woods Don Rickles,"In Las Vegas, two best friends--a casino executive and a Mafia enforcer--compete for a gambling empire and a fast-living, fast-loving socialite.",https://image.tmdb.org/t/p/w500/gziIkUSnYuj9ChCi8qOu2ZunpSC.jpg
17,Sense and Sensibility (1995),1995,Drama|Romance,Ang Lee,Emma Thompson Kate Winslet Alan Rickman Hugh Grant Gemma Jones,"The Dashwood sisters, sensible Elinor and passionate Marianne, learn that their prospects of marriage seem doomed by their family's sudden loss of fortune. After Henry Dashwood dies unexpectedly, his estate must pass on by law to his son. These circumstances leave Mr. Dashwood's wife and daughters without a home and with barely enough money to live on. As Elinor and Marianne struggle to find romantic fulfillment in a society obsessed with financial and social status, they must learn to mix sense with sensibility in their dealings with both money and men.",https://image.tmdb.org/t/p/w500/cBK2yL3HqhFvIVd7lLtazWlRZPR.jpg
18,Four Rooms (1995),1995,Comedy,Robert Rodriguez,Tim Roth Jennifer Beals David Proval Ione Skye Madonna,It's Ted the Bellhop's first night on the job...and the hotel's very unusual guests are about to place him in some outrageous predicaments. It seems that this evening's room service is serving up one unbelievable happening after another.,https://image.tmdb.org/t/p/w500/75aHn1NOYXh4M7L5shoeQ6NGykP.jpg
19,Ace Ventura: When Nature Calls (1995),1995,Comedy,Steve Oedekerk,Jim Carrey Ian McNeice Simon Callow Maynard Eziashi Bob Gunton,"Summoned from an ashram in Tibet, Ace finds himself on a perilous journey into the jungles of Africa to find Shikaka, the missing sacred animal of the friendly Wachati tribe. He must accomplish this before the wedding of the Wachati's Princess to the prince of the warrior Wachootoos. If Ace fails, the result will be a vicious tribal war.",https://image.tmdb.org/t/p/w500/wcinCf1ov2D6M3P7BBZkzQFOiIb.jpg
20,Money Train (1995),1995,Action|Comedy|Crime|Drama|Thriller,Joseph Ruben,Wesley Snipes Woody Harrelson Jennifer Lopez Robert Blake Chris Cooper,"When a vengeful New York transit cop decides to steal a trainload of subway fares, his foster brother—a fellow cop—tries to protect him.",https://image.tmdb.org/t/p/w500/jWBDz6Mf9aQVBiUS76JQsEhvoJl.jpg
21,Get Shorty (1995),1995,Comedy|Crime|Thriller,Barry Sonnenfeld,John Travolta Gene Hackman Rene Russo Danny DeVito Dennis Farina,"Chili Palmer is a Miami mobster who gets sent to L.A. to collect a bad debt from Harry Zimm, a Hollywood producer who specializes in cheesy horror films. When Chili meets Harry's leading lady, the romantic sparks fly. After pitching his own life story as a movie idea, Chili learns that being a mobster and being a Hollywood producer really aren't all that different.",https://image.tmdb.org/t/p/w500/r82SdPhg4fnIcLt0ogIjQxqjdcO.jpg
22,Copycat (1995),1995,Crime|Drama|Horror|Mystery|Thriller,Jon Amiel,Sigourney Weaver Holly Hunter Dermot Mulroney William McNamara Harry Connick Jr.,An agoraphobic psychologist and a female detective must work together to take down a serial killer who copies serial killers from the past.,https://image.tmdb.org/t/p/w500/oMgwJb016znNZcpDR20eXxZoW8A.jpg
23,Assassins (1995),1995,Action|Crime|Thriller,Richard Donner,Sylvester Stallone Antonio Banderas Julianne Moore Anatoli Davydov Muse Watson,"Assassin Robert Rath arrives at a funeral to kill a prominent mobster, only to witness a rival hired gun complete the job for him -- with grisly results. Horrified by the murder of innocent bystanders, Rath decides to take one last job and then return to civilian life. But finding his way out of the world of contract killing grows ever more dangerous as Rath falls for his female target and becomes a marked man himself.",https://image.tmdb.org/t/p/w500/wPmZYnaQpxwoHmwNwVhZ2IY0UbF.jpg
24,Powder (1995),1995,Drama|Sci-Fi,Victor Salva,Mary Steenburgen Sean Patrick Flanery Lance Henriksen Jeff Goldblum Brandon Smith,"Harassed by classmates who won't accept his shocking appearance, a shy young man known as ""Powder"" struggles to fit in. But the cruel taunts stop when Powder displays a mysterious power that allows him to do incredible things. This phenomenon changes the lives of all those around him in ways they never could have imagined.",https://image.tmdb.org/t/p/w500/aQSA63T7zyzZxBZxr2MQaxt1gtO.jpg
25,Leaving Las Vegas (1995),1995,Drama|Romance,Mike Figgis,Nicolas Cage Elisabeth Shue Julian Sands Richard Lewis Steven Weber,"Ben Sanderson, an alcoholic Hollywood screenwriter who lost everything because of his drinking, arrives in Las Vegas to drink himself to death. There, he meets and forms an uneasy friendship and non-interference pact with prostitute Sera.",https://image.tmdb.org/t/p/w500/wTrFpGe3U65kXTldIUxuM2hmOAK.jpg
26,Othello (1995),1995,Drama,Oliver Parker,Laurence Fishburne Irène Jacob Kenneth Branagh Nathaniel Parker Michael Maloney,The evil Iago pretends to be friend of Othello in order to manipulate him to serve his own end in the film version of this Shakespeare classic.,https://image.tmdb.org/t/p/w500/kyevuYzW36wKadiE8lftLac5VwQ.jpg
27,Now and Then (1995),1995,Children|Drama,Lesli Linka Glatter,Christina Ricci Rosie O'Donnell Thora Birch Melanie Griffith Gaby Hoffmann,"Waxing nostalgic about the bittersweet passage from childhood to puberty, four childhood girlfriends — Teeny, Chrissy, Samantha and Roberta — recall the magical summer of 1970. During their walk down memory lane, they reconcile experiences with boys, secrets, bullies and more.",https://image.tmdb.org/t/p/w500/q31Ks8oAmM4Nq2CcGjyYYpdBAmh.jpg
28,Persuasion (1995),1995,Drama|Romance,Roger Michell,Amanda Root Ciarán Hinds Susan Fleetwood Corin Redgrave Fiona Shaw,"In early 19th-century England, dire financial straits reacquaint the aristocratic Anne Elliot with her wealthy ex-fiance Frederick Wentworth. The two must choose between either putting the past behind them or listening to their hearts.",https://image.tmdb.org/t/p/w500/10hycdhFLq3M3y0ONxIMSiY8Mrs.jpg
29,"City of Lost Children, The (Cité des enfants perdus, La) (1995)",1995,Adventure|Drama|Fantasy|Mystery|Sci-Fi,Jean-Pierre Jeunet,Ron Perlman Dominique Pinon Judith Vittet Daniel Emilfork Jean-Claude Dreyfus,"A scientist in a surrealist society kidnaps children to steal their dreams, hoping that they slow his aging process.",https://image.tmdb.org/t/p/w500/whwT3Q9JxbAYzEc3t7uYYcCbTMf.jpg
30,Shanghai Triad (Yao a yao yao dao waipo qiao) (1995),1995,Crime|Drama,Zhang Yimou,Gong Li Li Baotian Sun Chun Li Xuejian Liu Jiang,"Shanghai, China, 1930. When young Shuisheng arrives from the countryside, his uncle Liushu puts him at the service of Bijou, the mistress of Laoda, supreme boss of the Tang Triad, constantly threatened by his enemies, both those he knows and those lurking in the shadows.",https://image.tmdb.org/t/p/w500/tzG1UxUSfPACREjgBrsPDRUvneH.jpg
31,Dangerous Minds (1995),1995,Drama,John N. Smith,Michelle Pfeiffer George Dzundza Courtney B. Vance Robin Bartlett Beatrice Winde,"Former Marine Louanne Johnson lands a gig teaching in a pilot program for bright but underachieving teens at a notorious inner-city high school. After having a terrible first day, she decides she must throw decorum to the wind. When Johnson returns to the classroom, she does so armed with a no-nonsense attitude informed by her military training and a fearless determination to better the lives of her students -- no matter what the cost.",https://image.tmdb.org/t/p/w500/yWHWC8fJRp2kLgiFrEa8o3krOH9.jpg
32,Twelve Monkeys (a.k.a. 12 Monkeys) (1995),Mystery|Sci-Fi|Thriller,,,,,
34,Babe (1995),1995,Children|Drama,Chris Noonan,Christine Cavanaugh Miriam Margolyes Danny Mann Hugo Weaving Miriam Flynn,"Babe is a little pig who doesn't quite know his place in the world. With a bunch of odd friends, like Ferdinand the duck who thinks he is a rooster and Fly the dog he calls mum, Babe realises that he has the makings to become the greatest sheep pig of all time, and Farmer Hoggett knows it. With the help of the sheep dogs, Babe learns that a pig can be anything that he wants to be.",https://image.tmdb.org/t/p/w500/zKuQMtnbVTz9DsOnOJmlW71v4qH.jpg
36,Dead Man Walking (1995),1995,Crime|Drama,Tim Robbins,Susan Sarandon Sean Penn Robert Prosky Raymond J. Barry R. Lee Ermey,A death row inmate turns for spiritual guidance to a local nun in the days leading up to his scheduled execution for the murders of a young couple.,https://image.tmdb.org/t/p/w500/eShxyjhWoFl3BwsuEmVsr4nLaMZ.jpg
38,It Takes Two (1995),1995,Children|Comedy,Andy Tennant,Kirstie Alley Steve Guttenberg Ashley Olsen Mary-Kate Olsen Jane Sibbett,"Identical 9-year-olds from very different backgrounds: orphaned Amanda and wealthy Alyssa meet at summer camp and decide to switch places -- and play matchmaker between Alyssa's dad, Roger, and the kind social worker who cares for Amanda.",https://image.tmdb.org/t/p/w500/4CptjFLiIJXtjc3dykS7vkEHMbw.jpg
39,Clueless (1995),1995,Comedy|Romance,Amy Heckerling,Alicia Silverstone Stacey Dash Brittany Murphy Paul Rudd Donald Faison,"Shallow, rich and socially successful Cher is at the top of her Beverly Hills high school's pecking scale. Seeing herself as a matchmaker, Cher first coaxes two teachers into dating each other. Emboldened by her success, she decides to give hopelessly klutzy new student Tai a makeover. When Tai becomes more popular than she is, Cher realizes that her disapproving ex-stepbrother was right about how misguided she was -- and falls for him.",https://image.tmdb.org/t/p/w500/8AwVTcgpTnmeOs4TdTWqcFDXEsA.jpg
40,"Cry, the Beloved Country (1995)",1995,Drama,Darrell James Roodt,Richard Harris James Earl Jones Charles S. Dutton Vusi Kunene Tsholofelo Wechoemang,A South-African preacher goes to search for his wayward son who has committed a crime in the big city.,https://image.tmdb.org/t/p/w500/96TZr6o4kuiIEryC5jkzaQoP6m5.jpg
41,Richard III (1995),1995,Drama|War,Richard Loncraine,Ian McKellen Annette Bening Jim Broadbent Robert Downey Jr. Kristin Scott Thomas,"Having helped his brother King Edward IV take the throne of England, the jealous hunchback Richard, Duke of Gloucester, plots to seize power for himself. Masterfully deceiving and plotting against nearly everyone in the royal court, including his eventual wife, Lady Anne, and his brother George, Duke of Clarence, Richard orchestrates a bloody rise to power before finding all his gains jeopardized by those he betrayed.",https://image.tmdb.org/t/p/w500/cBg1AMH1ucPsDlNMfcHlrreQXQX.jpg
42,Dead Presidents (1995),1995,Action|Crime|Drama,Albert Hughes,Larenz Tate Keith David Chris Tucker Freddy Rodríguez Rose Jackson,On the streets they call cash dead presidents. And that's just what a Vietnam veteran is after when he returns home from the war only to find himself drawn into a life of crime. With the aid of his fellow vets he plans the ultimate heist -- a daring robbery of an armored car filled with unmarked U.S. currency!,https://image.tmdb.org/t/p/w500/eGfsSXizR11tTHVo0kuOOFPAxZt.jpg
43,Restoration (1995),1995,Drama,Michael Hoffman,Robert Downey Jr. Meg Ryan Sam Neill David Thewlis Hugh Grant,"An aspiring young physician, Robert Merivel found himself in the service of King Charles II and saves the life of someone close to the King. Merivel joins the King's court and lives the high life provided to someone of his position. Merivel is ordered to marry his King's mistress in order to divert the queens suspicions. He is given one order by the king and that is not to fall in love. The situation worsens when Merivel finds himself in love with his new wife. Eventually, the King finds out and relieves Merivel of his position and wealth. His fall from grace leaves Merivel where he first started. And through his travels and reunions with an old friend, he rediscovers his love for true medicine and what it really means to be a physician.",https://image.tmdb.org/t/p/w500/z1YM3WFZnF2NwHT5IRGYUcvZBSl.jpg
44,Mortal Kombat (1995),1995,Action|Adventure|Fantasy,Paul W. S. Anderson,Robin Shou Cary-Hiroyuki Tagawa Linden Ashby Bridgette Wilson-Sampras Christopher Lambert,"For nine generations an evil sorcerer has been victorious in hand-to-hand battle against his mortal enemies. If he wins a tenth Mortal Kombat tournament, desolation and evil will reign over the multiverse forever. To save Earth, three warriors must overcome seemingly insurmountable odds, their own inner demons, and superhuman foes.",https://image.tmdb.org/t/p/w500/9YhpvhhvLrtL1wlwEfpVL16GI9d.jpg
45,To Die For (1995),1995,Comedy|Drama|Thriller,Gus Van Sant,Nicole Kidman Matt Dillon Joaquin Phoenix Casey Affleck Illeana Douglas,"Suzanne Stone wants to be a world-famous news anchor and she is willing to do anything to get what she wants. What she lacks in intelligence, she makes up for in cold determination and diabolical wiles. As she pursues her goal with relentless focus, she is forced to destroy anything and anyone that may stand in her way, regardless of the ultimate cost or means necessary.",https://image.tmdb.org/t/p/w500/whz4bwvqE1OmQHIyqHdZD8jU9CO.jpg
46,How to Make an American Quilt (1995),1995,Drama|Romance,Jocelyn Moorhouse,Winona Ryder Anne Bancroft Ellen Burstyn Kate Nelligan Jean Simmons,"Soon-to-be-wed graduate student Finn Dodd develops cold feet when she suspects her fiancé is cheating on her. In order to clear her head, Finn visits her grandmother, Hy, and great aunt, Glady Joe Cleary, in Grasse, Calif. There, Finn learns that Hy and Glady Joe are members of a group of passionate quilters, and over the course of her visit she is regaled with tales of love and life by women who have collected rich experiences and much wisdom.",https://image.tmdb.org/t/p/w500/pI9UAemlWgdrnjRgYJsbTk8BSJc.jpg
47,Seven (a.k.a. Se7en) (1995),Mystery|Thriller,,,,,
48,Pocahontas (1995),1995,Animation|Children|Drama|Musical|Romance,Mike Gabriel,Irene Bedard Mel Gibson David Ogden Stiers John Kassir Christian Bale,"Pocahontas, daughter of a Native American tribe chief, falls in love with an English soldier as colonists invade 17th century Virginia.",https://image.tmdb.org/t/p/w500/kZ1ft0QZ4e3zDUPMBftEkwI9ftd.jpg
49,When Night Is Falling (1995),1995,Drama|Romance,Patricia Rozema,Pascale Bussières Rachael Crawford Henry Czerny David Fox Don McKellar,"Camille is a professor at a Protestant college and is in a long-term relationship with Martin, a respected minister and fellow professor. When Camille meets Petra, a bold and flamboyant performer in a circus troupe, she is inexplicably drawn. Pursuing Petra, Camille throws her whole conservative life into disarray.",https://image.tmdb.org/t/p/w500/6Ac5GLwJ01uli5mCXqXwquR36Y1.jpg
50,"Usual Suspects, The (1995)",1995,Crime|Mystery|Thriller,Bryan Singer,Stephen Baldwin Gabriel Byrne Benicio del Toro Kevin Pollak Kevin Spacey,"Held in an L.A. interrogation room, Verbal Kint attempts to convince the feds that a mythic crime lord, Keyser Soze, not only exists, but was also responsible for drawing him and his four partners into a multi-million dollar heist that ended with an explosion in San Pedro harbor – leaving few survivors. Verbal lures his interrogators with an incredible story of the crime lord's almost supernatural prowess.",https://image.tmdb.org/t/p/w500/99X2SgyFunJFXGAYnDv3sb9pnUD.jpg
52,Mighty Aphrodite (1995),1995,Comedy|Drama|Romance,Woody Allen,Woody Allen Mira Sorvino Helena Bonham Carter F. Murray Abraham Donald Symington,"When Lenny and his wife, Amanda, adopt a baby, Lenny realizes that his son is a genius and becomes obsessed with finding the boy's biological mother in hopes that she will be brilliant too. But when he learns that Max's mother is Linda Ash, a kindhearted prostitute and porn star, Lenny is determined to reform her immoral lifestyle. A Greek chorus chimes in to relate the plot to Greek mythology in this quirky comedy.",https://image.tmdb.org/t/p/w500/ice135yQZp4iX2SgCmd90nKgS5j.jpg
53,Lamerica (1994),1994,Adventure|Drama,Gianni Amelio,Enrico Lo Verso Michele Placido Piro Milkani Carmelo Di Mazzarelli Elida Janushi,"Fiore, an Italian conman, arrives in post Communist Albania with Gino, his young apprentice, to set up a shoe factory that will never open. The con requires a native Albanian, so they designate Spiro, an impoverished and confused former political prisoner as chairman of the board. When Fiore returns to Italy to get government funds for the project, Spiro unexpectedly disappears and Gino sets out on a journey to find him. The search leads him to discover Spiro's tragic personal history and witness Albanian poverty firsthand.",https://image.tmdb.org/t/p/w500/nnLpA4mqb3gvhNJQZ00cOyBmeq3.jpg
54,"Big Green, The (1995)",1995,Children|Comedy,Holly Goldberg Sloan,Olivia D'Abo Steve Guttenberg Chauncey Leopardi Patrick Renna Billy L. Sullivan,"In a depressed Texas town, British foreign exchange teacher Anna attempts to inject some life into her hopeless kids by introducing them to soccer. They're terrible at first, but Anna and her football-hero assistant whip them into shape. As they work overtime, the pair help kids build their self-esteem and also get involved in solving family squabbles.",https://image.tmdb.org/t/p/w500/nVHqIuBTcTLmAIrML7T704UwfNI.jpg
55,Georgia (1995),1995,Drama,Ulu Grosbard,Jennifer Jason Leigh Mare Winningham Ted Levine Max Perlich John Doe,"Sadie looks up to her older sister Georgia, a successful folk singer. Unfortunately it is this very obsession — coupled with her self-destructive tendencies and rampant drug abuse — that keeps her spiraling down the drain.",https://image.tmdb.org/t/p/w500/uXjfK404xo7SiVlFcAoRyaFqXR4.jpg
57,Home for the Holidays (1995),1995,Drama,Jodie Foster,Holly Hunter Robert Downey Jr. Anne Bancroft Charles Durning Dylan McDermott,"After losing her job, making out with her soon-to-be former boss, and finding out that her daughter plans to spend Thanksgiving with her boyfriend, Claudia Larson faces spending the holiday with her unhinged family.",https://image.tmdb.org/t/p/w500/3zqlKdOttWyExzopVxglz50Vjxq.jpg
58,"Postman, The (Postino, Il) (1994)",1994,Comedy|Drama|Romance,Michael Radford,Massimo Troisi Philippe Noiret Maria Grazia Cucinotta Renato Scarpa Linda Moretti,Simple Italian postman learns to love poetry while delivering mail to a famous poet; he uses this to woo local beauty Beatrice.,https://image.tmdb.org/t/p/w500/cUaCpjVDefYShKyLmkcDsiPaBHn.jpg
60,"Indian in the Cupboard, The (1995)",1995,Adventure|Children|Fantasy,Frank Oz,Hal Scardino Litefoot Lindsay Crouse Richard Jenkins Rishi Bhat,A nine-year-old boy gets a plastic Indian and a cupboard for his birthday and finds himself involved in adventure when the Indian comes to life and befriends him.,https://image.tmdb.org/t/p/w500/ozQAmW85tTJu2dhRe3evzyY03Nb.jpg
