movieId,title,year,genres,director,cast,overview,poster
196054,Me Before You,2016,"Drama,Romance",Thea Sharrock,Emilia Clarke Sam Claflin Janet McTeer Charles Dance Brendan Coyle,"Lou Clark, a directionless 26-year-old from the English countryside, takes a job at the local castle as a caregiver and companion to a wealthy young banker, Will Traynor. Wheelchair-bound from an accident two years prior, the once adventurous Will has all but given up — that is until Lou determines to show him that life is worth living.",https://image.tmdb.org/t/p/w500/Ia3dzj5LnCj1ZBdlVeJrbKJQxG.jpg
196055,Popstar: Never Stop Never Stopping,2016,"Comedy,Music",Akiva Schaffer,Andy Samberg Jorma Taccone Akiva Schaffer Sarah Silverman Tim Meadows,"When his new album fails to sell records, pop/rap superstar Conner4real goes into a major tailspin and watches his celebrity high life begin to collapse. He'll try anything to bounce back, anything except reuniting with his old rap group The Style Boyz.",https://image.tmdb.org/t/p/w500/jBZeZZNjYBUU21zFvBnin5n62bv.jpg
196056,The Conjuring 2,2016,"Horror,Thriller",James Wan,Vera Farmiga Patrick Wilson Madison Wolfe Frances O'Connor Lauren Esposito,Lorraine and Ed Warren travel to north London to help a single mother raising four children alone in a house plagued by malicious spirits.,https://image.tmdb.org/t/p/w500/zEqyD0SBt6HL7W9JQoWwtd5Do1T.jpg
196057,Warcraft,2016,"Action,Adventure,Fantasy",Duncan Jones,Travis Fimmel Paula Patton Ben Foster Dominic Cooper Ben Schnetzer,"The peaceful realm of Azeroth stands on the brink of war as its civilization faces a fearsome race of invaders: orc warriors fleeing their dying home to colonize another. As a portal opens to connect the two worlds, one army faces destruction and the other faces extinction. From opposing sides, two heroes are set on a collision course that will decide the fate of their family, their people, and their home.",https://image.tmdb.org/t/p/w500/eGi5aoxaZveqNLtE7BZJCuWwR3G.jpg
196058,Now You See Me 2,2016,"Crime,Thriller,Action,Mystery",Jon M. Chu,Jesse Eisenberg Mark Ruffalo Woody Harrelson Dave Franco Daniel Radcliffe,"One year after outwitting the FBI and winning the public’s adulation with their mind-bending spectacles, the Four Horsemen resurface only to find themselves face to face with a new enemy who enlists them to pull off their most dangerous heist yet.",https://image.tmdb.org/t/p/w500/A81kDB6a1K86YLlcOtZB27jriJh.jpg
196059,Finding Dory,2016,"Adventure,Animation,Comedy,Family",Andrew Stanton,Albert Brooks Ellen DeGeneres Ed O'Neill Hayden Rolence Diane Keaton,Dory is reunited with her friends Nemo and Marlin in the search for answers about her past. What can she remember? Who are her parents? And where did she learn to speak Whale?,https://image.tmdb.org/t/p/w500/3UVe8NL1E2ZdUZ9EDlKGJY5UzE.jpg
196060,Central Intelligence,2016,"Action,Comedy,Crime,Mystery",Rawson Marshall Thurber,Dwayne Johnson Kevin Hart Amy Ryan Danielle Nicolet Jason Bateman,"Calvin Joyner, a mild-mannered accountant whose high school glory days are long behind him, reconnects with an awkward pal from high school through Facebook. After meeting up, Calvin’s mundane life takes an unexpectedly thrilling turn when he's thrust into the world of international espionage.",https://image.tmdb.org/t/p/w500/hXQVMbRNpf7c93e8clMY4W5DRm6.jpg
196061,Independence Day: Resurgence,2016,"Action,Adventure,Science Fiction",Roland Emmerich,Liam Hemsworth Jeff Goldblum Jessie T. Usher Bill Pullman Maika Monroe,"We always knew they were coming back. Using recovered alien technology, the nations of Earth have collaborated on an immense defense program to protect the planet. But nothing can prepare us for the aliens’ advanced and unprecedented force. Only the ingenuity of a few brave men and women can bring our world back from the brink of extinction.",https://image.tmdb.org/t/p/w500/9S50foUIYGwiNPWOxi1WJF6IPwI.jpg
196062,The Shallows,2016,"Horror,Drama,Thriller",Jaume Collet-Serra,Blake Lively Óscar Jaenada Brett Cullen Janelle Bailey Sedona Legge,"While surfing on a secluded beach, Nancy finds herself in the feeding grounds of a great white shark. Though stranded only 200 yards from shore, survival proves to be the ultimate test of wills, requiring all of her ingenuity, resourcefulness, and fortitude.",https://image.tmdb.org/t/p/w500/bnBV7hZmLuA0Si5Aop481sPF2RY.jpg
196063,Free State of Jones,2016,"Action,Drama,History,War",Gary Ross,Matthew McConaughey Gugu Mbatha-Raw Mahershala Ali Keri Russell Jacob Lofland,"In 1863, Mississippi farmer Newt Knight serves as a medic for the Confederate Army. Opposed to slavery, Knight would rather help the wounded than fight the Union. After his nephew dies in battle, Newt returns home to Jones County to safeguard his family but is soon branded an outlaw deserter. Forced to flee, he finds refuge with a group of runaway slaves hiding out in the swamps. Forging an alliance with the slaves and other farmers, Knight leads a rebellion that would forever change history.",https://image.tmdb.org/t/p/w500/fTB6p9QwPRKIuK5LtB5CZXlkx5b.jpg
196064,The Neon Demon,2016,"Thriller,Horror",Nicolas Winding Refn,Elle Fanning Karl Glusman Jena Malone Bella Heathcote Abbey Lee,"When aspiring model Jesse moves to Los Angeles, her youth and vitality are devoured by a group of beauty-obsessed women who will take any means necessary to get what she has.",https://image.tmdb.org/t/p/w500/3rBo2AfWSlvsPmYFdJsNUMfkNIo.jpg
196065,Swiss Army Man,2016,"Comedy,Drama,Romance,Fantasy,Adventure",Daniel Kwan,Paul Dano Daniel Radcliffe Mary Elizabeth Winstead Antonia Ribero Timothy Eulich,"Alone on a tiny deserted island, Hank has given up all hope of ever making it home again. But one day everything changes when a dead body washes ashore, and he soon realizes it may be his last opportunity to escape certain death. Armed with his new “friend” and an unusual bag of tricks, the duo go on an epic adventure to bring Hank back to the woman of his dreams.",https://image.tmdb.org/t/p/w500/8pxn8CQ6SD6tly75lrKw08wfZKv.jpg
196066,The Legend of Tarzan,2016,"Fantasy,Action,Adventure",David Yates,Alexander Skarsgård Christoph Waltz Samuel L. Jackson Margot Robbie Djimon Hounsou,"Tarzan, having acclimated to life in London, is called back to his former home in the jungle to investigate the activities at a mining encampment.",https://image.tmdb.org/t/p/w500/eJrfz178xBGlxjDGxnBXTzWWa4w.jpg
196067,The BFG,2016,"Adventure,Family,Fantasy",Steven Spielberg,Mark Rylance Ruby Barnhill Rebecca Hall Jemaine Clement Bill Hader,"An orphan little girl befriends a benevolent giant who takes her to Giant Country, where they attempt to stop the man-eating giants that are invading the human world.",https://image.tmdb.org/t/p/w500/w17Mc2x2olB5CtewznUFxgpvne0.jpg
196068,The Purge: Election Year,2016,"Action,Horror,Thriller",James DeMonaco,Elizabeth Mitchell Frank Grillo Mykelti Williamson Betty Gabriel J. J. Soria,"Two years after choosing not to kill the man who killed his son, former police sergeant Leo Barnes has become head of security for Senator Charlene Roan, the front runner in the next Presidential election due to her vow to eliminate the Purge. On the night of what should be the final Purge, a betrayal from within the government forces Barnes and Roan out onto the street where they must fight to survive the night.",https://image.tmdb.org/t/p/w500/gg7tlp45xqGWMra0sqQVPvybje2.jpg
196069,Marauders,2016,"Action,Crime,Thriller",Steven C. Miller,Bruce Willis Dave Bautista Christopher Meloni Danny A. Abeckaser Lydia Hull,An untraceable group of elite bank robbers is chased by a suicidal FBI agent who uncovers a deeper purpose behind the robbery-homicides.,https://image.tmdb.org/t/p/w500/bAvmDn5C7arBoRrfaG3b3Kdue1q.jpg
196070,The Secret Life of Pets,2019,"Adventure,Comedy,Animation,Family",Chris Renaud,Patton Oswalt Kevin Hart Eric Stonestreet Jenny Slate Tiffany Haddish,"Max the terrier must cope with some major life changes when his owner gets married and has a baby. When the family takes a trip to the countryside, nervous Max has numerous run-ins with canine-intolerant cows, hostile foxes and a scary turkey. Luckily for Max, he soon catches a break when he meets Rooster, a gruff farm dog who tries to cure the lovable pooch of his neuroses.",https://image.tmdb.org/t/p/w500/s9xg4V5EDKiphgIksVJ9gewBM11.jpg
196071,Mike and Dave Need Wedding Dates,2016,Comedy,Jake Szymanski,Zac Efron Anna Kendrick Adam Devine Aubrey Plaza Sam Richardson,"Mike and Dave are young, adventurous, fun-loving brothers who tend to get out of control at family gatherings. When their sister Jeanie reveals her Hawaiian wedding plans, the rest of the Stangles insist that the brothers bring respectable dates. After placing an ad on Craigslist, the siblings decide to pick Tatiana and Alice, two charming and seemingly normal women. Once they arrive on the island, however, Mike and Dave realize that their companions are ready to get wild and party.",https://image.tmdb.org/t/p/w500/alWBdyvXf1LSixnn1IfID5HMtLx.jpg
196072,The Infiltrator,2016,"Crime,Drama,Thriller",Brad Furman,Bryan Cranston Diane Kruger John Leguizamo Daniel Mays Benjamin Bratt,A U.S Customs official uncovers a massive money laundering scheme involving Pablo Escobar.,https://image.tmdb.org/t/p/w500/758F57DxVRLe38S1Je4O1Bjx2u6.jpg
196073,Café Society,2016,"Comedy,Drama,Romance",Woody Allen,Jesse Eisenberg Kristen Stewart Steve Carell Blake Lively Parker Posey,"The story of a young man who arrives in Hollywood during the 1930s hoping to work in the film industry, falls in love, and finds himself swept up in the vibrant café society that defined the spirit of the age.",https://image.tmdb.org/t/p/w500/q9fohCRpQ7m8OTyi82fxa3B86te.jpg
196074,Star Trek Beyond,2016,"Action,Adventure,Science Fiction",Justin Lin,Chris Pine Zachary Quinto Karl Urban Zoe Saldaña Simon Pegg,"The USS Enterprise crew explores the furthest reaches of uncharted space, where they encounter a mysterious new enemy who puts them and everything the Federation stands for to the test.",https://image.tmdb.org/t/p/w500/m7SHlvcGfCkbzk2xP7XHDOI6o93.jpg
196075,Batman: The Killing Joke,2016,"Action,Animation,Crime,Drama",Sam Liu,Kevin Conroy Mark Hamill Tara Strong Ray Wise John DiMaggio,"As Batman hunts for the escaped Joker, the Clown Prince of Crime attacks the Gordon family to prove a diabolical point mirroring his own fall into madness.",https://image.tmdb.org/t/p/w500/lrQ3LeNIN0nmviZ692seNBUl1Pq.jpg
196076,Ice Age: Collision Course,2016,"Adventure,Animation,Family,Comedy,Science Fiction",Mike Thurmeier,Ray Romano John Leguizamo Denis Leary Queen Latifah Seann William Scott,"Set after the events of Continental Drift, Scrat's epic pursuit of his elusive acorn catapults him outside of Earth, where he accidentally sets off a series of cosmic events that transform and threaten the planet. To save themselves from peril, Manny, Sid, Diego, and the rest of the herd leave their home and embark on a quest full of thrills and spills, highs and lows, laughter and adventure while traveling to exotic new lands and locations.",https://image.tmdb.org/t/p/w500/okF78W1AcXAenlYFE3vna9Uuqjp.jpg
196077,Lights Out,2016,"Horror,Thriller,Mystery",David F. Sandberg,Teresa Palmer Maria Bello Gabriel Bateman Alexander DiPersia Alicia Vela-Bailey,"Rebecca must unlock the terror behind her little brother's experiences that once tested her sanity, bringing her face to face with a supernatural spirit attached to their mother.",https://image.tmdb.org/t/p/w500/8BnElzAQQpp7ZgdJJiAe1diomr4.jpg
196078,Nerve,2016,"Mystery,Adventure,Crime",Henry Joost,Emma Roberts Dave Franco Emily Meade Miles Heizer Juliette Lewis,"Industrious high school senior Vee Delmonico has had it with living life on the sidelines. When pressured by friends to join the popular online game Nerve, Vee decides to sign up for just one dare in what seems like harmless fun. But as she finds herself caught up in the thrill of the adrenaline-fueled competition partnered with a mysterious stranger, the game begins to take a sinister turn with increasingly dangerous acts, leading her into a high stakes finale that will determine her entire future.",https://image.tmdb.org/t/p/w500/qmSpHC0CSNyNll9WhlwWYuwoQ28.jpg
196079,Jason Bourne,2016,"Action,Thriller,Mystery",Paul Greengrass,Matt Damon Tommy Lee Jones Alicia Vikander Vincent Cassel Julia Stiles,The most dangerous former operative of the CIA is drawn out of hiding to uncover hidden truths about his past.,https://image.tmdb.org/t/p/w500/xA7N41glw17MBQtcWSm2eBlBRuG.jpg
196080,Bad Moms,2016,Comedy,Scott Moore,Mila Kunis Kristen Bell Kathryn Hahn Christina Applegate Jada Pinkett Smith,"When three overworked and under-appreciated moms are pushed beyond their limits, they ditch their conventional responsibilities for a jolt of long overdue freedom, fun, and comedic self-indulgence.",https://image.tmdb.org/t/p/w500/u9q10ljhkLj0tNCjlVqe3DCjoU4.jpg
196081,Suicide Squad,2021,"Action,Adventure,Fantasy",James Gunn,Margot Robbie Idris Elba John Cena Joel Kinnaman Sylvester Stallone,"Supervillains Harley Quinn, Bloodsport, Peacemaker and a collection of nutty cons at Belle Reve prison join the super-secret, super-shady Task Force X as they are dropped off at the remote, enemy-infused island of Corto Maltese.",https://image.tmdb.org/t/p/w500/q61qEyssk2ku3okWICKArlAdhBn.jpg
196082,Nine Lives,2016,"Fantasy,Comedy,Family",Barry Sonnenfeld,Kevin Spacey Jennifer Garner Robbie Amell Cheryl Hines Mark Consuelos,A stuffy businessman finds himself trapped inside the body of his family's cat.,https://image.tmdb.org/t/p/w500/i457G22lL9t2yhEFdYz5Nd1M5DV.jpg
196083,Pete's Dragon,2016,"Adventure,Family,Fantasy",David Lowery,Oakes Fegley Bryce Dallas Howard Wes Bentley Karl Urban Oona Laurence,"For years, old wood carver Mr. Meacham has delighted local children with his tales of the fierce dragon that resides deep in the woods of the Pacific Northwest. To his daughter, Grace, who works as a forest ranger, these stories are little more than tall tales... until she meets Pete, a mysterious 10-year-old with no family and no home who claims to live in the woods with a giant, green dragon named Elliott. And from Pete's descriptions, Elliott seems remarkably similar to the dragon from Mr. Meacham's stories. With the help of Natalie, an 11-year-old girl whose father Jack owns the local lumber mill, Grace sets out to determine where Pete came from, where he belongs, and the truth about this dragon.",https://image.tmdb.org/t/p/w500/A9x4Ogk8KUXTfU649NS6lS9TCmu.jpg
196084,Sausage Party,2016,"Adventure,Animation,Comedy,Fantasy",Conrad Vernon,Seth Rogen Kristen Wiig Jonah Hill Bill Hader Michael Cera,Hot dog Frank leads a group of supermarket products on a quest to discover the truth about their existence and what really happens when they're chosen to leave the grocery store.,https://image.tmdb.org/t/p/w500/vNgdPJQ5CI60oEiiHLKRNrsDhMy.jpg
196085,Florence Foster Jenkins,2016,"Comedy,Drama",Stephen Frears,Meryl Streep Hugh Grant Simon Helberg Rebecca Ferguson Nina Arianda,"The story of Florence Foster Jenkins, a New York heiress, who dreamed of becoming an opera singer, despite having a terrible singing voice.",https://image.tmdb.org/t/p/w500/1HAdtUchzWEo0LMFHrgD2UBIBS3.jpg
196086,Hell or High Water,2016,"Western,Crime,Drama",David Mackenzie,Jeff Bridges Chris Pine Ben Foster Gil Birmingham Marin Ireland,A divorced dad and his ex-con brother resort to a desperate scheme in order to save their family's farm in West Texas.,https://image.tmdb.org/t/p/w500/ljRRxqy2aXIkIBXLmOVifcOR021.jpg
196087,Kubo and the Two Strings,2016,"Animation,Adventure,Family",Travis Knight,Art Parkinson Charlize Theron Brenda Vaccaro Cary-Hiroyuki Tagawa Meyrick Murphy,"Kubo mesmerizes the people in his village with his magical gift for spinning wild tales with origami. When he accidentally summons an evil spirit seeking vengeance, Kubo is forced to go on a quest to solve the mystery of his fallen samurai father and his mystical weaponry, as well as discover his own magical powers.",https://image.tmdb.org/t/p/w500/ewcOCkuuKAKULGUnbBVaO1htt0D.jpg
196088,War Dogs,2016,"Comedy,Crime,Drama",Todd Phillips,Miles Teller Jonah Hill Ana de Armas Bradley Cooper Kevin Pollak,"Based on the true story of two young men, David Packouz and Efraim Diveroli, who won a $300 million contract from the Pentagon to arm America's allies in Afghanistan.",https://image.tmdb.org/t/p/w500/mDcPRjZC1bb6LavFU3gwsWdVfCM.jpg
196089,Mechanic: Resurrection,2016,"Action,Crime,Thriller",Dennis Gansel,Jason Statham Jessica Alba Tommy Lee Jones Michelle Yeoh Sam Hazeldine,"Arthur Bishop thought he had put his murderous past behind him when his most formidable foe kidnaps the love of his life. Now he is forced to travel the globe to complete three impossible assassinations, and do what he does best, make them look like accidents.",https://image.tmdb.org/t/p/w500/bG3Q6EFcngpPn7uPuQTzTuq9DgV.jpg
196090,Don't Breathe,2016,"Thriller,Horror",Fede Álvarez,Stephen Lang Jane Levy Dylan Minnette Daniel Zovatto Emma Bercovici,A group of teens break into a blind man's home thinking they'll get away with the perfect crime. They're wrong.,https://image.tmdb.org/t/p/w500/dSxHyPZ2nipSfvdft4IhQKjk5eZ.jpg
196091,Hands of Stone,2016,Drama,Jonathan Jakubowicz,Edgar Ramírez Robert De Niro Usher Rubén Blades Ana de Armas,The legendary Roberto Duran and his equally legendary trainer Ray Arcel change each other's lives.,https://image.tmdb.org/t/p/w500/rpAYkkc7ltnxnMXOZLPuI9A6cuB.jpg
196092,The 9th Life of Louis Drax,2016,"Fantasy,Mystery,Thriller,Drama",Alexandre Aja,Jamie Dornan Sarah Gadon Aaron Paul Molly Parker Aiden Longworth,A psychologist who begins working with a young boy who has suffered a near-fatal fall finds himself drawn into a mystery that tests the boundaries of fantasy and reality.,https://image.tmdb.org/t/p/w500/w1DUBuhET3OEPBwoay8UL2OUxs.jpg
196093,The Light Between Oceans,2016,"Drama,Romance",Derek Cianfrance,Michael Fassbender Alicia Vikander Rachel Weisz Bryan Brown Jack Thompson,A lighthouse keeper and his wife living off the coast of Western Australia raise a baby they rescue from an adrift rowboat.,https://image.tmdb.org/t/p/w500/c9S6VKZPllNgdxBUuI3GYJiqcKO.jpg
196094,Morgan,2016,"Horror,Science Fiction,Thriller",Luke Scott,Kate Mara Anya Taylor-Joy Toby Jones Rose Leslie Boyd Holbrook,A corporate risk-management consultant must determine whether or not to terminate an artificial being's life that was made in a laboratory environment.,https://image.tmdb.org/t/p/w500/iqEFG5ldyeLIFPp7mMI7ZmS7Upm.jpg
196095,Sully,2016,"Drama,History",Clint Eastwood,Tom Hanks Aaron Eckhart Anna Gunn Holt McCallany Mike O'Malley,"On 15 January 2009, the world witnessed the 'Miracle on the Hudson' when Captain 'Sully' Sullenberger glided his disabled plane onto the Hudson River, saving the lives of all 155 souls aboard. However, even as Sully was being heralded by the public and the media for his unprecedented feat of aviation skill, an investigation was unfolding that threatened to destroy his reputation and career.",https://image.tmdb.org/t/p/w500/4vs83YcJ8TsabADDtaeCJ6ZTjYY.jpg
196096,When the Bough Breaks,2016,"Mystery,Thriller,Drama,Horror",Jon Cassar,Morris Chestnut Regina Hall Jaz Sinclair Romany Malco Michael Kenneth Williams,A surrogate mother harbors a deadly secret desire for a family of her own with the husband who is expecting to raise her child.,https://image.tmdb.org/t/p/w500/4QqhN9jZkY33yMvknGI4YpM3TYv.jpg
196097,The Disappointments Room,2016,"Horror,Thriller",D.J. Caruso,Kate Beckinsale Mel Raido Duncan Joiner Lucas Till Gerald McRaney,A mother and her young son release unimaginable horrors from the attic of their rural dream home.,https://image.tmdb.org/t/p/w500/4zHfitHwW1XDaJo9IF8LOsUbnif.jpg
196098,Bridget Jones's Baby,2016,"Comedy,Romance",Sharon Maguire,Renée Zellweger Colin Firth Patrick Dempsey Jim Broadbent Gemma Jones,"After breaking up, Bridget Jones' happily-ever-after hasn't quite gone according to plan. Fortysomething and single again, she decides to focus on her job and surround herself with old friends and new. For once, Bridget has everything completely under control. Then her love life takes a turn when she meets Jack. A week later, she runs into Mark before she finds herself pregnant, but with one hitch - she's not sure of the identity of her baby's father - Mark or Jack.",https://image.tmdb.org/t/p/w500/5hHomngoPZrNoXOPlyaHV6eXaQW.jpg
196099,Snowden,2016,"Drama,History,Crime,Thriller",Oliver Stone,Joseph Gordon-Levitt Shailene Woodley Melissa Leo Zachary Quinto Tom Wilkinson,CIA employee Edward Snowden leaks thousands of classified documents to the press.,https://image.tmdb.org/t/p/w500/yfK7zxNL63VWfluFuoUaJj5PdNw.jpg
196100,Blair Witch,1999,"Thriller,Horror",Daniel Myrick,Heather Donahue Joshua Leonard Michael C. Williams Bob Griffin Jim King,"In October of 1994 three student filmmakers disappeared in the woods near Burkittsville, Maryland, while shooting a documentary. A year later their footage was found.",https://image.tmdb.org/t/p/w500/9050VGrYjYrEjpOvDZVAngLbg1f.jpg
196101,Hillsong: Let Hope Rise,2016,"Documentary,Music",Michael John Warren,Michael Guy Chislett Matt Crocker Adam Crosariol Jonathon Douglass Taya Smith,"Chronicles the unlikely rise to prominence of the Australia-based Christian band, Hillsong United.",https://image.tmdb.org/t/p/w500/2D8qF4eKzzvQ1tkEejXiPZWBCsx.jpg
196102,The Magnificent Seven,2016,"Adventure,Action,Western",Antoine Fuqua,Denzel Washington Chris Pratt Ethan Hawke Vincent D'Onofrio Lee Byung-hun,"Looking to mine for gold, greedy industrialist Bartholomew Bogue seizes control of the Old West town of Rose Creek. With their lives in jeopardy, Emma Cullen and other desperate residents turn to bounty hunter Sam Chisolm for help. Chisolm recruits an eclectic group of gunslingers to take on Bogue and his ruthless henchmen. With a deadly showdown on the horizon, the seven mercenaries soon find themselves fighting for more than just money once the bullets start to fly.",https://image.tmdb.org/t/p/w500/ezcS78TIjgr85pVdaPDd2rSPVNs.jpg
196103,Storks,2016,"Adventure,Animation,Comedy,Family",Doug Sweetland,Andy Samberg Katie Crown Kelsey Grammer Jennifer Aniston Ty Burrell,"Storks deliver babies…or at least they used to. Now they deliver packages for a global internet retail giant. Junior, the company’s top delivery stork, is about to be promoted when he accidentally activates the Baby Making Machine, producing an adorable and wholly unauthorized baby girl...",https://image.tmdb.org/t/p/w500/pwGolX8JmGJhhcUjO5SJt38Uk0m.jpg
196104,Miss Peregrine's Home for Peculiar Children,2016,"Fantasy,Adventure,Family,Drama",Tim Burton,Eva Green Asa Butterfield Samuel L. Jackson Judi Dench Rupert Everett,A teenager finds himself transported to an island where he must help protect a group of orphans with special powers from creatures intent on destroying them.,https://image.tmdb.org/t/p/w500/CIlbMFOfYDj0MP23hsIYhFGrL6.jpg
196105,Deepwater Horizon,2016,"Drama,Action",Peter Berg,Mark Wahlberg Kurt Russell John Malkovich Gina Rodriguez Dylan O'Brien,"A story set on the offshore drilling rig Deepwater Horizon, which exploded during April 2010 and created the worst oil spill in U.S. history.",https://image.tmdb.org/t/p/w500/9IFt6tOf6o7CnaDlgB9uE8Cr1WZ.jpg
196106,Queen of Katwe,2016,Drama,Mira Nair,"Madina Nalwanga David Oyelowo Lupita Nyong'o Martin Kabanza Taryn ""Kay"" Kyaze",A young girl overcomes her disadvantaged upbringing in the slums of Uganda to become a Chess master.,https://image.tmdb.org/t/p/w500/m8V2ud6uhV7qH6wEDoQ4Ujw99ji.jpg
196107,Masterminds,2016,"Action,Comedy,Crime",Jared Hess,Zach Galifianakis Owen Wilson Kristen Wiig Kate McKinnon Leslie Jones,A night guard at an armored car company in the Southern U.S. organizes one of the biggest bank heists in American history.,https://image.tmdb.org/t/p/w500/4CXgye1p8Vr7taDG389QhhHDUZ4.jpg
196108,The Birth of a Nation,1915,Drama,D.W. Griffith,Lillian Gish Mae Marsh Henry B. Walthall Miriam Cooper Mary Alden,"Two families, abolitionist Northerners the Stonemans and Southern landowners the Camerons, intertwine. When Confederate colonel Ben Cameron is captured in battle, nurse Elsie Stoneman petitions for his pardon. In Reconstruction-era South Carolina, Cameron founds the Ku Klux Klan, battling Elsie's congressman father and his African-American protégé, Silas Lynch.",https://image.tmdb.org/t/p/w500/pNpOXpQI5GSUfiWypubYtMh9928.jpg
196109,Middle School: The Worst Years of My Life,2016,"Family,Comedy",Steve Carr,Griffin Gluck Lauren Graham Alexa Nisenson Andy Daly Thomas Barbusca,A quiet teenage artist Rafe Katchadorian has a wild imagination and is sick of middle school and the rules that have been put before him. Rafe and his best friend Leo have come up with a plan: break every rule in the school hand book and as you expect trouble follows.,https://image.tmdb.org/t/p/w500/3rlcvuGlLETfGCq0aaVD526Emlc.jpg
196110,The Accountant,2025,"Crime,Thriller,Drama",Gavin O'Connor,Ben Affleck Jon Bernthal Cynthia Addai-Robinson J.K. Simmons Allison Robertson,"When an old acquaintance is murdered, Wolff is compelled to solve the case. Realizing more extreme measures are necessary, Wolff recruits his estranged and highly lethal brother, Brax, to help. In partnership with Marybeth Medina, they uncover a deadly conspiracy, becoming targets of a ruthless network of killers who will stop at nothing to keep their secrets buried.",https://image.tmdb.org/t/p/w500/lUvfTcOZiK0sdcX0WNLPbMyKjGm.jpg
196111,Kevin Hart: What Now?,2016,Comedy,Leslie Small,Kevin Hart Halle Berry Don Cheadle Ed Helms David Meunier,"Comedian Kevin Hart performs in front of a crowd of 50,000 people at Philadelphia's outdoor venue, Lincoln Financial Field.",https://image.tmdb.org/t/p/w500/lFg4tx0jAYkgrcm1bPBlM0FbQvH.jpg
