movieId,title,year,genres,director,cast,overview,poster
365,Little Buddha (1993),1993,Drama,Bernardo Bertolucci,Keanu Reeves Bridget Fonda Chris Isaak Ruocheng Ying Alex Wiesendanger,"After the death of Lama Dorje, Tibetan Buddhist monks find three children — one American and two Nepalese — who may be the rebirth of their great teacher.",https://image.tmdb.org/t/p/w500/xy70xtdoKZ3PxlKkakwdhL3UFDQ.jpg
366,"Wes Craven's New Nightmare (Nightmare on Elm Street Part 7: Freddy's Finale, A) (1994)",1994,Drama|Horror|Mystery|Thriller,Wes Craven,Heather Langenkamp Robert Englund Miko Hughes Wes Craven David Newsom,A demonic force has chosen Freddy Krueger as its portal to the real world. Can Heather Langenkamp play the part of Nancy one last time and trap the evil trying to enter our world?,https://image.tmdb.org/t/p/w500/q5BWxfL1x34nyYSvA3Qo5odleGW.jpg
367,"Mask, The (1994)",1994,Action|Comedy|Crime|Fantasy,Chuck Russell,Jim Carrey Peter Riegert Peter Greene Amy Yasbeck Richard Jeni,"Timid bank clerk Stanley Ipkiss discovers a magical mask infused with the spirit of the Norse god Loki. Donning it transforms him into an unrestrained, green-faced, cartoon-like wild man. While the mask grants him the confidence to woo a local singer, it also makes him the target of a ruthless mobster.",https://image.tmdb.org/t/p/w500/jPC2eYub74zwf2tPGVtzSlBW6Oy.jpg
368,Maverick (1994),1994,Adventure|Comedy|Western,Richard Donner,Mel Gibson Jodie Foster James Garner Graham Greene Alfred Molina,"Bret Maverick is a gambler who would rather con someone than fight them, and needs an additional $3k in order to enter a winner-takes-all poker game beginning in a few days. He joins forces with a woman with a marvelous Southern accent, and the two try and enter the game.",https://image.tmdb.org/t/p/w500/mTVbGGi5PIexmxVzeyFd2RYKwfM.jpg
369,Mrs. Parker and the Vicious Circle (1994),1994,Drama,Alan Rudolph,Jennifer Jason Leigh Campbell Scott Matthew Broderick Peter Gallagher Jennifer Beals,"Dorothy Parker remembers the heyday of the Algonquin Round Table, a circle of friends whose barbed wit, like hers, was fueled by alcohol and flirted with despair.",https://image.tmdb.org/t/p/w500/avTHiIim0Jm0rs4ehFLck8u3NFW.jpg
370,Naked Gun 33 1/3: The Final Insult (1994),1994,Action|Comedy,Peter Segal,Leslie Nielsen Priscilla Presley George Kennedy O. J. Simpson Fred Ward,"Frank Drebin is persuaded out of retirement to go undercover in a state prison. There he has to find out what top terrorist, Rocco, has planned for when he escapes. Adding to his problems, Frank's wife, Jane, is desperate for a baby.",https://image.tmdb.org/t/p/w500/p0AYsdgkudR9P5fNV5AjzbwQt8W.jpg
371,"Paper, The (1994)",1994,Comedy|Drama,Ron Howard,Michael Keaton Robert Duvall Glenn Close Marisa Tomei Randy Quaid,"Henry Hackett is the workaholic editor of a New York City tabloid. He loves his job, but the long hours and low pay are leading to discontent. Also, publisher Bernie White faces financial straits, and has hatchet-man Alicia Clark—Henry's nemesis—impose unpopular cutbacks.",https://image.tmdb.org/t/p/w500/pGPrFbucRLwVtCKCeinwAklAl0l.jpg
372,Reality Bites (1994),1994,Comedy|Drama|Romance,Ben Stiller,Winona Ryder Ethan Hawke Janeane Garofalo Steve Zahn Ben Stiller,"A small circle of friends suffering from post-collegiate blues must confront the hard truth about life, love and the pursuit of gainful employment. As they struggle to map out survival guides for the future, the Gen-X quartet soon begins to realize that reality isn't all it's cracked up to be.",https://image.tmdb.org/t/p/w500/qGDhodtpkpxkrFqokenGNJlzt6w.jpg
374,Richie Rich (1994),1994,Children|Comedy,Donald Petrie,Macaulay Culkin John Larroquette Edward Herrmann Christine Ebersole Jonathan Hyde,"Billionaire heir Richie Rich has it all, including Reggie Jackson as a batting coach and Claudia Schiffer as a personal trainer -- but no playmates. What's more, scoundrel Laurence Van Dough is scheming to take over the family empire. Uh-oh! Enter faithful butler Cadbury to save the day.",https://image.tmdb.org/t/p/w500/qgGh5d0IHAZRlHIdFS3XWVygumR.jpg
376,"River Wild, The (1994)",1994,Action|Thriller,Curtis Hanson,Meryl Streep David Strathairn Kevin Bacon John C. Reilly Joseph Mazzello,"Gail and Tom Hartman are struggling to stay together and decide to take a white-water rafting holiday adventure in Montana for their son Roarke's 10th birthday, only to meet up with a pair of mysterious men whose desperation grows, turning their vacation into a nightmare.",https://image.tmdb.org/t/p/w500/wVgQ2T63ThjIsY4R0qoHXjyllql.jpg
377,Speed (1994),1994,Action|Romance|Thriller,Jan de Bont,Keanu Reeves Dennis Hopper Sandra Bullock Joe Morton Jeff Daniels,Tensions run high when a crazed bomber rigs a Los Angeles bus with a device that will kill everyone on board if the vehicle's speed dips below fifty miles per hour.,https://image.tmdb.org/t/p/w500/82PkCE4R95KhHICUDF7G4Ly2z3l.jpg
378,Speechless (1994),1994,Comedy|Romance,Ron Underwood,Michael Keaton Geena Davis Bonnie Bedelia Christopher Reeve Ernie Hudson,"In the midst of election season in New Mexico, political speechwriters Julia Mann and Kevin Vallick begin a romance, unaware they are working for candidates on opposite sides.",https://image.tmdb.org/t/p/w500/bremBHwg2cAvFIGIRwlRtPMkgfL.jpg
379,Timecop (1994),1994,Action|Sci-Fi|Thriller,Peter Hyams,Jean-Claude Van Damme Mia Sara Ron Silver Bruce McGill Gloria Reuben,"In 2004, an officer for a security agency that regulates time travel must fend for his life against a shady politician who has a tie to his past.",https://image.tmdb.org/t/p/w500/bgxP6ws8ErBiarnb4S93vv0lkf4.jpg
380,True Lies (1994),1994,Action|Adventure|Comedy|Romance|Thriller,James Cameron,Arnold Schwarzenegger Jamie Lee Curtis Tom Arnold Bill Paxton Tia Carrere,"A fearless, globe-trotting, terrorist-battling secret agent has his life turned upside down when he discovers his wife might be having an affair with a used car salesman while terrorists smuggle nuclear war heads into the United States.",https://image.tmdb.org/t/p/w500/pweFTnzzTfGK68woSVkiTgjLzWm.jpg
381,When a Man Loves a Woman (1994),1994,Drama|Romance,Luis Mandoki,Andy Garcia Meg Ryan Tina Majorino Philip Seymour Hoffman Mae Whitman,"An airline pilot and his wife are forced to face the consequences of her alcoholism when her addictions threaten her life and their daughter's safety. While the woman enters detox, her husband must face the truth of his enabling behavior.",https://image.tmdb.org/t/p/w500/cA1uMNX3sdWAWfMZbsgm1VIJYSY.jpg
382,Wolf (1994),1994,Drama|Horror|Romance|Thriller,Mike Nichols,Jack Nicholson Michelle Pfeiffer James Spader Kate Nelligan Richard Jenkins,"An aging publisher becomes a demon wolf and, with this newfound youthful vigor, fights to keep his job.",https://image.tmdb.org/t/p/w500/5TprU55U2zjAMCwr2jQra3zj1zu.jpg
383,Wyatt Earp (1994),1994,Western,Lawrence Kasdan,Kevin Costner Dennis Quaid Gene Hackman David Andrews Linden Ashby,"From Wichita to Dodge City, to the O.K. Corral in Tombstone, Wyatt Earp is taught that nothing matters more than family and the law. Joined by his brothers and Doc Holliday, Earp wages war on the dreaded Clanton and McLaury gangs.",https://image.tmdb.org/t/p/w500/51LItgyecu2KMAtIchYogEykCIu.jpg
384,Bad Company (1995),1995,Action|Crime|Drama,Damian Harris,Laurence Fishburne Ellen Barkin Frank Langella Michael Beach David Ogden Stiers,"CIA operative Nelson Crowe is tasked with a deadly assignment: infiltrate a highly secret industrial espionage firm. Once inside, he teams with Margaret Wells, a master spy and seductive manipulator, in a plot to overthrow the organization's sinister president, which leads them into a darkly mysterious web of intrigue -- and shocking murder!",https://image.tmdb.org/t/p/w500/5q5r3cpaTDByz4qko9ZWHlK3gMF.jpg
385,"Man of No Importance, A (1994)",1994,Drama,Suri Krishnamma,Albert Finney Brenda Fricker Michael Gambon Tara Fitzgerald Rufus Sewell,"Alfie Byrne is a middle-aged bus conductor in Dublin in 1963. He would appear to live a life of quiet desperation: he's gay, but firmly closeted, and his sister is always trying to find him ""the right girl"". His passion is Oscar Wilde, his hobby is putting on amateur theatre productions in the local church hall. We follow him as he struggles with temptation, friendship, disapproval, and the conservative yet oddly lyrical world of Ireland in the early 1960s.",https://image.tmdb.org/t/p/w500/zKHmxia0cdXMmNu5LUEwiJQJQoa.jpg
386,S.F.W. (1994),1995,Drama,Jefery Levy,Stephen Dorff Reese Witherspoon Jake Busey Joey Lauren Adams Pamela Gidley,An alienated and misanthropic teenager gains sudden and unwanted celebrity status after he's taken hostage by terrorists where his indifference to their threats to kill him makes news headlines.,https://image.tmdb.org/t/p/w500/3bq91jWCReRrqlPn81alSoxeXoP.jpg
387,"Low Down Dirty Shame, A (1994)",1994,Action|Comedy,Keenen Ivory Wayans,Keenen Ivory Wayans Charles S. Dutton Jada Pinkett Smith Salli Richardson-Whitfield Andrew Divoff,"A black detective becomes embroiled in a web of danger while searching for a fortune in missing drug money. During the course of his investigation, he encounters various old connections, ultimately confronting the criminal responsible for Shame's expulsion from the force. He must also deal with two women, Angela, a beautiful old flame, and Peaches, his energetic but annoying sidekick.",https://image.tmdb.org/t/p/w500/v5XUfLrdoGfatObGXhqckYTNqFT.jpg
389,"Colonel Chabert, Le (1994)",1994,Drama|Romance|War,Yves Angelo,Gérard Depardieu Fanny Ardant Fabrice Luchini André Dussollier Éric Elmosnino,"When Colonel Chabert returns from the war, he discovers that he has lost everything.",https://image.tmdb.org/t/p/w500/Usaduh828gtYe6jw9DosnPJ7I9.jpg
390,Faster Pussycat! Kill! Kill! (1965),1965,Action|Crime|Drama,Russ Meyer,Tura Satana Haji Lori Williams Sue Bernard Stuart Lancaster,"A trio of thrill-seeking go-go dancers kidnap a young girl and attempt to seduce an old rancher and his two sons out of their small fortune, but their scheme doesn't play out as intended.",https://image.tmdb.org/t/p/w500/2hIHFk52SZ9XsZB4U85RUq36BT4.jpg
391,Jason's Lyric (1994),1994,Crime|Drama,Doug McHenry,Allen Payne Jada Pinkett Smith Bokeem Woodbine Eddie Griffin Suzzanne Douglas,The story of a young man who must confront his own fears about love as well as his relationships with family and friends.,https://image.tmdb.org/t/p/w500/2dXA5dNh3kqDQwRt08TxxgldTOW.jpg
393,Street Fighter (1994),1994,Action|Adventure|Fantasy,Steven E. de Souza,Jean-Claude Van Damme Raúl Juliá Kylie Minogue Byron Mann Damian Chapa,Colonel Guile and various other martial arts heroes fight against the tyranny of dictator M. Bison and his cohorts.,https://image.tmdb.org/t/p/w500/6yh95dD2Y6uWAlPfWCZZygBM1ec.jpg
407,In the Mouth of Madness (1995),1995,Horror|Thriller,John Carpenter,Sam Neill Julie Carmen Jürgen Prochnow David Warner John Glover,An insurance investigator visits a small town while looking into the strange disappearance of a popular horror novelist. He soon finds that the impact of the author’s books is far more than inspirational.,https://image.tmdb.org/t/p/w500/msh4tEUzbnEqlHcFOUH4O0Zti8r.jpg
408,8 Seconds (1994),1994,Drama,John G. Avildsen,Luke Perry Stephen Baldwin Red Mitchell Cynthia Geary James Rebhorn,"This film chronicles the life of Lane Frost, 1987 PRCA Bull Riding World Champion, his marriage and his friendships with Tuff Hedeman (three-time World Champion) and Cody Lambert.",https://image.tmdb.org/t/p/w500/wqKVkOveZrK6zwfrptGLVPmnMpR.jpg
409,Above the Rim (1994),1994,Crime|Drama,Jeff Pollack,Duane Martin Tupac Shakur Bernie Mac Marlon Wayans Leon,"Story of a promising high school basketball star and his relationships with two brothers, one a drug dealer and the other a former basketball star fallen on hard times and now employed as a security guard.",https://image.tmdb.org/t/p/w500/56NFHuZXdgZbVxvCyYw92E5uLQa.jpg
410,Addams Family Values (1993),1993,Children|Comedy|Fantasy,Barry Sonnenfeld,Anjelica Huston Raúl Juliá Christopher Lloyd Joan Cusack Christina Ricci,"Siblings Wednesday and Pugsley Addams will stop at nothing to get rid of Pubert, the new baby boy adored by parents Gomez and Morticia. Things go from bad to worse when the new ""black widow"" nanny, Debbie Jellinsky, launches her plan to add Fester to her collection of dead husbands.",https://image.tmdb.org/t/p/w500/sdxT2VjVSx9DRicwnuECUdBHeE7.jpg
412,"Age of Innocence, The (1993)",1993,Drama,Martin Scorsese,Daniel Day-Lewis Michelle Pfeiffer Winona Ryder Alexis Smith Geraldine Chaplin,"In 19th century New York high society, a young lawyer falls in love with a woman separated from her husband, while he is engaged to the woman's cousin.",https://image.tmdb.org/t/p/w500/5Tuyt26v7qNR8Cl3m7ZRx36rduf.jpg
413,Airheads (1994),1994,Comedy,Michael Lehmann,Brendan Fraser Steve Buscemi Adam Sandler Joe Mantegna Chris Farley,The Lone Rangers have heavy-metal dreams and a single demo tape they can't get anyone to play. The solution: Hijack an FM rock radio station and hold the deejays hostage until they agree to broadcast the band's tape.,https://image.tmdb.org/t/p/w500/4xPG8pPMyeoec48gKWbbC85EC8j.jpg
414,"Air Up There, The (1994)",1994,Comedy,Paul Michael Glaser,Kevin Bacon Charles Gitonga Maina Yolanda Vazquez Mabutho 'Kid' Sithole Sean McCann,"Jimmy Dolan is a college basketball coach who wants a big promotion. To get it, he needs to make a dramatic find. He ends up deep in Africa, hoping to recruit Saleh, a huge basketball prodigy Jimmy glimpsed in a home movie. But Saleh is the chief's son and has responsibilities at home, since the tribe's land is threatened by a mining company with its own hotshot basketball team.",https://image.tmdb.org/t/p/w500/lY1yhtg0DRaMTzclYCXo0sP1kAV.jpg
415,Another Stakeout (1993),1993,Comedy|Thriller,John Badham,Richard Dreyfuss Emilio Estevez Rosie O'Donnell Dennis Farina Miguel Ferrer,A pair of immature detectives are joined by a pesky assistant district attorney in staking out a lakeside home where an important Mafia trial witness is believed to be heading.,https://image.tmdb.org/t/p/w500/hBItFUmCrRS1mel0TM69ymBD79k.jpg
416,Bad Girls (1994),1994,Western,Jonathan Kaplan,Madeleine Stowe Mary Stuart Masterson Andie MacDowell Drew Barrymore James Russo,"Four former harlots try to leave the wild west (Colorado, to be exact) and head north to make a better life for themselves. Unfortunately someone from Cody's past won't let it happen that easily.",https://image.tmdb.org/t/p/w500/cXY79luLXt2dzUP2Tx601zpZFzK.jpg
417,Barcelona (1994),1994,Comedy|Romance,Whit Stillman,Taylor Nichols Chris Eigeman Tushka Bergen Mira Sorvino Pep Munné,"During the 1980s, uptight Ted Boynton is a salesman working in the Barcelona office of a Chicago-based company. He receives an unexpected visit from his cousin Fred, a naval officer who has come to Spain on a public relations mission for a U.S. fleet. Not exactly friends in the past, Ted and Fred strike up relationships with women in the Spanish city and experience conflicts -- Ted with his employer, and Fred with the Barcelona community.",https://image.tmdb.org/t/p/w500/7dgX3naR9EsFMvQhwHY8My6r5FR.jpg
419,"Beverly Hillbillies, The (1993)",1993,Comedy,Penelope Spheeris,Jim Varney Diedrich Bader Erika Eleniak Cloris Leachman Lily Tomlin,"Mild-mannered dirt-poor hill-dweller Jed Clampett strikes it rich when oil is discovered on his property. At cousin Pearl's insistence, he moves his family to Beverly Hills to better enjoy his newfound wealth.",https://image.tmdb.org/t/p/w500/refYLEQvzkY63i2IHronCPQODex.jpg
420,Beverly Hills Cop III (1994),1994,Action|Comedy|Crime|Thriller,John Landis,Eddie Murphy Judge Reinhold Héctor Elizondo Timothy Carhart John Saxon,"When his boss is killed, Detroit cop Axel Foley finds evidence that the murderer had ties to a California amusement park called Wonder World. Returning to sunny Beverly Hills once more, Foley reunites with Detective Billy Rosewood to solve the case. Along with Billy's new partner, Detective Jon Flint, they discover that Wonder World is being used as a front for a massive counterfeiting ring.",https://image.tmdb.org/t/p/w500/7vIpCkgGEfk5LZwm78nMxswLJRH.jpg
421,Black Beauty (1994),1994,Adventure|Children|Drama,Caroline Thompson,Alan Cumming Docs Keepin Time Sean Bean David Thewlis Jim Carter,"The fates of horses, and the people who own and command them, are revealed as Black Beauty narrates the circle of his life.",https://image.tmdb.org/t/p/w500/5uH60FBDPQoyAnc4uvU0fIB8JXv.jpg
422,Blink (1994),1993,Thriller,Michael Apted,Madeleine Stowe Aidan Quinn James Remar Peter Friedman Bruce A. Young,"Emma is an attractive girl in her 20s who has been blind for 20 years. A new type of eye operation partially restores her sight, but she is having problems: sometimes she doesn't ""remember"" what she's seen until later. One night she is awakened by a commotion upstairs. Peering out of her door, she sees a shadowy figure descending the stairs. Convinced that her neighbour has been murdered she approaches the police, only to find that she is unsure if it was just her new eyes playing tricks on her.",https://image.tmdb.org/t/p/w500/wP6dfv85SQLogoNguUd6jO1A4be.jpg
423,Blown Away (1994),1994,Action|Thriller,Stephen Hopkins,Jeff Bridges Tommy Lee Jones Suzy Amis Lloyd Bridges Forest Whitaker,"Blown Away tells the story of Jimmy Dove, who works for the Boston bomb squad. Shortly after Dove leaves the force, his partner is killed by a bomb that Dove thinks might have been made by someone he knows.",https://image.tmdb.org/t/p/w500/fD23iryzdjfRU05nQAQriD0A3AR.jpg
424,Blue Chips (1994),1994,Drama,William Friedkin,Nick Nolte Shaquille O'Neal Mary McDonnell Ed O'Neill J.T. Walsh,"Pete Bell, a college basketball coach is under a lot of pressure. His team isn't winning and he cannot attract new players. The stars of the future are secretly being paid by boosters. This practice is forbidden in the college game, but Pete is desperate and has pressures from all around.",https://image.tmdb.org/t/p/w500/tO71i4Ob64tchCRBB5MoqonPKAF.jpg
425,Blue Sky (1994),1994,Drama|Romance,Tony Richardson,Jessica Lange Tommy Lee Jones Powers Boothe Carrie Snodgress Amy Locane,"Hank Marshall is a tough, square-jawed, straitlaced Army engineer and nuclear science expert, assigned to help conduct weapons testing in 1950s America. Hank has become a thorn in the side of the Army, though, for a couple of very different reasons. He is an outspoken opponent of atmospheric testing, though his superiors hold contrary views and want to squelch his concerns...and his reports. The other problem is his wife, Carly. She is voluptuous and volatile, wreaking havoc in his personal life and stirring up intrigue at each new Army base.",https://image.tmdb.org/t/p/w500/zG40OnO4Y98lo1iDHyFo5TaZyP1.jpg
426,Body Snatchers (1993),1993,Horror|Sci-Fi|Thriller,Abel Ferrara,Terry Kinney Meg Tilly Gabrielle Anwar Reilly Murphy Billy Wirth,"When Environmental Protection Agency inspector Steve Malone travels to a remote military base in order to check for toxic materials, he brings his family along for the ride. After arriving at the base, his teenage daughter Marti befriends Jean Platt, daughter of the base's commander, General Platt. When people at the base begin acting strangely, Marti becomes convinced that they are slowly being replaced by plant-like aliens.",https://image.tmdb.org/t/p/w500/s9zdfUeWjgK1ipTyaB6ikhtC9Wb.jpg
427,Boxing Helena (1993),1993,Drama|Mystery|Romance|Thriller,Jennifer Lynch,Julian Sands Sherilyn Fenn Bill Paxton Art Garfunkel Betsy Clark,"A top surgeon is besotted with a beautiful woman who once rebuffed him. Unable to come to terms with life without her, he tries to convince her that they need each other. She has other ideas, but a horrific accident leaves her at his mercy.",https://image.tmdb.org/t/p/w500/vgs0h94IllpZRheIjBTonjR7Zf2.jpg
428,"Bronx Tale, A (1993)",1993,Drama,Robert De Niro,Robert De Niro Chazz Palminteri Lillo Brancato Francis Capra Taral Hicks,"Set in the Bronx during the tumultuous 1960s, an adolescent boy is torn between his honest, working-class father and a violent yet charismatic crime boss. Complicating matters is the youngster's growing attraction - forbidden in his neighborhood - for a beautiful black girl.",https://image.tmdb.org/t/p/w500/sDbO6LmLYtyqAoFTPpRcMgPSCEO.jpg
429,Cabin Boy (1994),1994,Comedy,Adam Resnick,Chris Elliott Ritch Brinkley James Gammon Brian Doyle-Murray Brion James,"A foul-mouthed finishing school graduate mistakenly winds up on an ill-fated fishing boat, and faces the wrath of a crew that considers him bad luck.",https://image.tmdb.org/t/p/w500/xy2BzE3siqU67VQCQ2k4xideNNM.jpg
430,Calendar Girl (1993),1993,Comedy|Drama,John Whitesell,Gabriel Olds Jason Priestley Jerry O'Connell Joe Pantoliano Steve Railsback,"Three young men go on an end of the summer trip to Hollywood, California. Their quest: to fulfill the fantasy of meeting Marilyn Monroe.",https://image.tmdb.org/t/p/w500/ljSqZTl5oophHsH1Qtyv7AF2BW6.jpg
431,Carlito's Way (1993),1993,Crime|Drama,Brian De Palma,Al Pacino Sean Penn Penelope Ann Miller John Leguizamo Ingrid Rogers,"Free after years in prison, Carlito Brigante intends to give up his criminal ways, but it's not long before the ex-con is sucked back into the New York City underworld.",https://image.tmdb.org/t/p/w500/g6D7mjQtndu768cusGmoEQY9fTB.jpg
432,City Slickers II: The Legend of Curly's Gold (1994),1994,Adventure|Comedy|Western,Paul Weiland,Billy Crystal Daniel Stern Jon Lovitz Jack Palance Patricia Wettig,"Mitch Robbins' 40th birthday begins quite well until he returns home and finds his brother Glen, the black sheep of the family, in his sofa. Nevertheless he is about to have a wonderful birthday-night with his wife when he discovers a treasure map of Curly by chance. Together with Phil and unfortunately Glen he tries to find the hidden gold of Curly's father in the desert of Arizona.",https://image.tmdb.org/t/p/w500/gh0lsyJARglhpbKmnY8i8M7V5bI.jpg
433,Clean Slate (1994),1994,Comedy,Mick Jackson,Dana Carvey Valeria Golino James Earl Jones Kevin Pollak Michael Gambon,"Pogue is a private eye with a problem: every morning when he wakes up, he has total amnesia, waking up with a 'blank slate'. Since he is in the middle of a hot investigation and has a developing romance, this is less than convenient.",https://image.tmdb.org/t/p/w500/kAYsvQvBVshLHGTIDGHcj9jTJq0.jpg
434,Cliffhanger (1993),1993,Action|Adventure|Thriller,Renny Harlin,Sylvester Stallone John Lithgow Michael Rooker Janine Turner Rex Linn,"A year after losing his friend in a tragic 4,000-foot fall, former ranger Gabe Walker and his partner, Hal, are called to return to the same peak to rescue a group of stranded climbers, only to learn the climbers are actually thieving hijackers who are looking for boxes full of money.",https://image.tmdb.org/t/p/w500/b28DOM54OHb1c7Lsk6Nu7Kwuonj.jpg
435,Coneheads (1993),1993,Comedy|Sci-Fi,Steve Barron,Dan Aykroyd Jane Curtin Michael McKean Laraine Newman Jason Alexander,"A pair of aliens arrive on Earth to prepare for invasion, but crash instead. With enormous cone-shaped heads, robotlike walks and an appetite for toilet paper, aliens Beldar and Prymatt don't exactly blend in with the population of Paramus, N.J. But for some reason, everyone believes them when they say they're from France.",https://image.tmdb.org/t/p/w500/vlpQnf0rl0FpMjWLS0TNd8Bog2F.jpg
436,Color of Night (1994),1994,Drama|Thriller,Richard Rush,Bruce Willis Jane March Rubén Blades Lesley Ann Warren Scott Bakula,A color-blind psychiatrist is stalked by an unknown killer after taking over his murdered friend's therapy group and becomes embroiled in an intense affair with a mysterious woman who may be connected to the crime.,https://image.tmdb.org/t/p/w500/w1OBPkf3BxeC7543YzFwiKIwBFJ.jpg
437,Cops and Robbersons (1994),1994,Comedy,Michael Ritchie,Chevy Chase Jack Palance Dianne Wiest Robert Davi David Barry Gray,"When the police discover that a mob hitman has moved in next door to the Robbersons, they set up a stakeout in the Robbersons' home. Hard-nosed, tough-as-nails Jake Stone and his young partner Tony Moore are assigned to the stakeout, but now it is a question of whether Jake can last long enough to capture the bad guys. The Robbersons want to help, and by doing so, drive Jake crazy.",https://image.tmdb.org/t/p/w500/wnkWgFU5UcLwbExCp1YtCg5Ox4E.jpg
438,"Cowboy Way, The (1994)",1994,Action|Comedy|Drama,Gregg Champion,Woody Harrelson Kiefer Sutherland Dylan McDermott Ernie Hudson Marg Helgenberger,"Two championship rodeo partners travel to New York to find their missing friend, Nacho Salazar who went missing there.",https://image.tmdb.org/t/p/w500/5oBVSzbWD85zRCKIWm0KvhypUZU.jpg
440,Dave (1993),1993,Comedy|Romance,Ivan Reitman,Kevin Kline Sigourney Weaver Frank Langella Kevin Dunn Ving Rhames,A sweet-natured Temp Agency operator and amateur Presidential look-alike is recruited by the Secret Service to become a temporary stand-in for the President of the United States.,https://image.tmdb.org/t/p/w500/n7wQlcexeER5bW7DvV8sji2vRRH.jpg
441,Dazed and Confused (1993),1993,Comedy,Richard Linklater,Jason London Matthew McConaughey Joey Lauren Adams Rory Cochrane Wiley Wiggins,"The adventures of a group of Texas teens on their last day of school in 1976, centering on student Randall Floyd, who moves easily among stoners, jocks and geeks. Floyd is a star athlete, but he also likes smoking weed, which presents a conundrum when his football coach demands he sign a ""no drugs"" pledge.",https://image.tmdb.org/t/p/w500/msG9awbLhVZwv1Eh9Ge7SofMexW.jpg
